mysql>  CREATE DATABASE assignment;
Query OK, 1 row affected (0.02 sec)

mysql> USE assignment;
Database changed
mysql> CREATE TABLE Customers (
    ->   id INT PRIMARY KEY AUTO_INCREMENT,
    ->   name VARCHAR(255),
    ->   email VARCHAR(255),
    ->   address VARCHAR(255),
    ->   phone_number VARCHAR(20)
    -> );
Query OK, 0 rows affected (0.05 sec)

mysql> SHOW TABLES;
+----------------------+
| Tables_in_assignment |
+----------------------+
| customers            |
+----------------------+
1 row in set (0.04 sec)

mysql> INSERT INTO Customers (id, name, email, address, phone_number)VALUES    (1, 'John Doe', 'john.doe@example.com', '123 Main St, Anytown', '555-1234'),    (2, 'Jane Smith', 'jane.smith@example.com', '456 Elm St, Anytown', '555-5678'),    (3, 'Mike Johnson', 'mike.johnson@example.com', '789 Oak St, Anytown', '555-9012'),    (4, 'Emily Brown', 'emily.brown@example.com', '321 Pine St, Anytown', '555-3456'),    (5, 'David Wilson', 'david.wilson@example.com', '654 Cedar St, Anytown', '555-7890');
Query OK, 5 rows affected (0.02 sec)
Records: 5  Duplicates: 0  Warnings: 0

mysql> SELECT * FROM assignment;
ERROR 1146 (42S02): Table 'assignment.assignment' doesn't exist
mysql> SELECT * FROM customers;
+----+--------------+--------------------------+-----------------------+--------------+
| id | name         | email                    | address               | phone_number |
+----+--------------+--------------------------+-----------------------+--------------+
|  1 | John Doe     | john.doe@example.com     | 123 Main St, Anytown  | 555-1234     |
|  2 | Jane Smith   | jane.smith@example.com   | 456 Elm St, Anytown   | 555-5678     |
|  3 | Mike Johnson | mike.johnson@example.com | 789 Oak St, Anytown   | 555-9012     |
|  4 | Emily Brown  | emily.brown@example.com  | 321 Pine St, Anytown  | 555-3456     |
|  5 | David Wilson | david.wilson@example.com | 654 Cedar St, Anytown | 555-7890     |
+----+--------------+--------------------------+-----------------------+--------------+
5 rows in set (0.00 sec)

mysql> SELECT name, email FROM Customers;
+--------------+--------------------------+
| name         | email                    |
+--------------+--------------------------+
| John Doe     | john.doe@example.com     |
| Jane Smith   | jane.smith@example.com   |
| Mike Johnson | mike.johnson@example.com |
| Emily Brown  | emily.brown@example.com  |
| David Wilson | david.wilson@example.com |
+--------------+--------------------------+
5 rows in set (0.00 sec)

mysql> SELECT * FROM Customers WHERE id = 3;
+----+--------------+--------------------------+---------------------+--------------+
| id | name         | email                    | address             | phone_number |
+----+--------------+--------------------------+---------------------+--------------+
|  3 | Mike Johnson | mike.johnson@example.com | 789 Oak St, Anytown | 555-9012     |
+----+--------------+--------------------------+---------------------+--------------+
1 row in set (0.00 sec)

mysql> SELECT * FROM Customers WHERE name LIKE 'A%';
Empty set (0.01 sec)

mysql> SELECT * FROM Customers ORDER BY name DESC;
+----+--------------+--------------------------+-----------------------+--------------+
| id | name         | email                    | address               | phone_number |
+----+--------------+--------------------------+-----------------------+--------------+
|  3 | Mike Johnson | mike.johnson@example.com | 789 Oak St, Anytown   | 555-9012     |
|  1 | John Doe     | john.doe@example.com     | 123 Main St, Anytown  | 555-1234     |
|  2 | Jane Smith   | jane.smith@example.com   | 456 Elm St, Anytown   | 555-5678     |
|  4 | Emily Brown  | emily.brown@example.com  | 321 Pine St, Anytown  | 555-3456     |
|  5 | David Wilson | david.wilson@example.com | 654 Cedar St, Anytown | 555-7890     |
+----+--------------+--------------------------+-----------------------+--------------+
5 rows in set (0.01 sec)

mysql> UPDATE Customers SET address = 'New Address' WHERE id = 4;
Query OK, 1 row affected (0.01 sec)
Rows matched: 1  Changed: 1  Warnings: 0

mysql> SELECT * FROM Customers ORDER BY id ASC LIMIT 3;
+----+--------------+--------------------------+----------------------+--------------+
| id | name         | email                    | address              | phone_number |
+----+--------------+--------------------------+----------------------+--------------+
|  1 | John Doe     | john.doe@example.com     | 123 Main St, Anytown | 555-1234     |
|  2 | Jane Smith   | jane.smith@example.com   | 456 Elm St, Anytown  | 555-5678     |
|  3 | Mike Johnson | mike.johnson@example.com | 789 Oak St, Anytown  | 555-9012     |
+----+--------------+--------------------------+----------------------+--------------+
3 rows in set (0.00 sec)

mysql> DELETE FROM Customers WHERE id = 2;
Query OK, 1 row affected (0.01 sec)

mysql> SELECT COUNT(*) FROM Customers;
+----------+
| COUNT(*) |
+----------+
|        4 |
+----------+
1 row in set (0.02 sec)

mysql> SELECT * FROM Customers ORDER BY id ASC OFFSET 2;
ERROR 1064 (42000): You have an error in your SQL syntax; check the manual that corresponds to your MySQL server version for the right syntax to use near 'OFFSET 2' at line 1
mysql> SELECT * FROM Customers ORDER BY id ASC OFFSET 2;
ERROR 1064 (42000): You have an error in your SQL syntax; check the manual that corresponds to your MySQL server version for the right syntax to use near 'OFFSET 2' at line 1
mysql> SELECT * FROM Customers WHERE id > 2 AND name LIKE 'B%';
Empty set (0.01 sec)

mysql> SELECT * FROM Customers WHERE id < 3 OR name LIKE '%s';
+----+----------+----------------------+----------------------+--------------+
| id | name     | email                | address              | phone_number |
+----+----------+----------------------+----------------------+--------------+
|  1 | John Doe | john.doe@example.com | 123 Main St, Anytown | 555-1234     |
+----+----------+----------------------+----------------------+--------------+
1 row in set (0.01 sec)

mysql> SELECT * FROM Customers WHERE phone_number IS NULL OR phone_number = '';
Empty set (0.01 sec)